{
  "id": "V4",
  "index": 4,
  "series_id": "SERIES",
  "title": "거짓된 신의 설계도",
  "objective": "기록보관소와 코어 중심부에서 도시의 원래 목적과 자신의 인공적 탄생 비밀을 깨닫는다.",
  "start_state": {
    "status": "진실 추적의 주체 확립"
  },
  "end_state": {
    "identity": "코어가 만든 인공 유기체(C16)"
  },
  "event_ids": [
    "V4-E01",
    "V4-E02",
    "V4-E03",
    "V4-E04"
  ]
}
