{
  "id": "V5",
  "index": 5,
  "series_id": "SERIES",
  "title": "백색 도서관의 파수꾼",
  "objective": "리안의 최종적인 희생을 통해 세상을 구원하고, 망각이 주는 진정한 평온을 묘사하며 마무리한다.",
  "start_state": {
    "rian": "엘라라를 제단에 바쳐야 하는 잔혹한 선택지에 놓임",
    "elara": "도시를 위해 자신을 희생하기로 결심함"
  },
  "end_state": {
    "rian": "잊힌 기억들을 지키며 타인의 행복을 통해 안식을 얻음",
    "elara": "이유 없는 그리움을 느끼며 새로운 내일을 기록함"
  },
  "event_ids": [
    "V5-E01",
    "V5-E02",
    "V5-E03",
    "V5-E04"
  ]
}
