{
  "id": "V1",
  "index": 1,
  "series_id": "SERIES",
  "title": "녹슨 거리의 은색 기록",
  "objective": "오볼루스의 세계관을 제시하고, 리안과 엘라라의 관계 및 기억 밀수 활동을 통해 도시의 부조리를 드러낸다.",
  "start_state": {
    "rian": "기억 소멸 상태",
    "elara": "기록 준비 상태"
  },
  "end_state": {
    "rian": "위원회가 은폐한 잔혹한 기억의 조각을 발견함",
    "elara": "도시의 시스템에 대한 강한 회의감을 느낌"
  },
  "event_ids": [
    "V1-E01",
    "V1-E02",
    "V1-E03",
    "V1-E04"
  ]
}
